Q,A
민심 수습은 개뿔 여기가 너 거래처냐?,아니 윤대리님이야말로 일 따온다면서요 
아니 윤대리님이야말로 일 따온다면서요 ,니 한 몸 불살라 지성사 지키겠다더니 넌 몸이 두개야? 거기서도 불살르고 여기서도 불살르게 조사장 빠돌이 조빠 주제에 아주 치가 떨린다 임마 진짜
니 한 몸 불살라 지성사 지키겠다더니 넌 몸이 두개야? 거기서도 불살르고 여기서도 불살르게 조사장 빠돌이 조빠 주제에 아주 치가 떨린다 임마 진짜,저야 말로 치 떨리네요 아이 또 어떤 회사를 망하게 할라고 영업직 면접을 보세요 보시긴? 
저야 말로 치 떨리네요 아이 또 어떤 회사를 망하게 할라고 영업직 면접을 보세요 보시긴? ,야 임마 너 말 다 했어 임마?
야 임마 너 말 다 했어 임마?,아니요 다 못 했는데요 이번 기회에 영업 그만두고 고향 내려가서 소똥이나 치우시죠 윤대리
이제 면접 다 끝난건가?,밖에 한 명 더 와있는데요
밖에 한 명 더 와있는데요,거 뭡니까?
거 뭡니까?,아 여기서 이러시면 안돼요 
아 여기서 이러시면 안돼요 ,사장님! 이 사람 절대로 절대로 뽑으시면 안돼요 절대 
사장님! 이 사람 절대로 절대로 뽑으시면 안돼요 절대 ,안녕하세요 면접 보러 온 윤서현
사랑해요 오마니.,이제 니 아버지가 안하니까 니가 하니? 어휴 내 팔자야. 어휴 내 팔자. 
이제 니 아버지가 안하니까 니가 하니? 어휴 내 팔자야. 어휴 내 팔자. ,내가 와 안하는데. 나도 이거 잘 한다. 사랑해요 물고메. 
피자 맛은 다 비슷하던데?,"뭐? 다 비슷? 이 화덕피자에서는 사계절의 맛이 나지. 초록색 바질이 향긋하게 코 끝을 간질이며 대지의 봄을 느끼게 하고, 빨간색 토마토 소스는 여름의 강렬한 태양의 맛을 선사해. 고소한 치즈의 맛은 가을의 풍요로움을, 은은하게 풍겨오는 장작향은 겨울의 맛을 전해주지. 아유, 이 누나 또 그새를 못참고 드시네."
"뭐? 다 비슷? 이 화덕피자에서는 사계절의 맛이 나지. 초록색 바질이 향긋하게 코 끝을 간질이며 대지의 봄을 느끼게 하고, 빨간색 토마토 소스는 여름의 강렬한 태양의 맛을 선사해. 고소한 치즈의 맛은 가을의 풍요로움을, 은은하게 풍겨오는 장작향은 겨울의 맛을 전해주지. 아유, 이 누나 또 그새를 못참고 드시네.",이 피자는 뜨거울 때 먹어야 제일 맛있는거 몰라요? 그 사계절 타령 듣다가 피자 다 식어빠지겠네.
이 피자는 뜨거울 때 먹어야 제일 맛있는거 몰라요? 그 사계절 타령 듣다가 피자 다 식어빠지겠네.,"이 누나는 음식의 맛만 알지, 음식의 멋을 몰라."
"이 누나는 음식의 맛만 알지, 음식의 멋을 몰라.",두 사람 또 시작이에요? 제발 친하게 좀 지내요.
두 사람 또 시작이에요? 제발 친하게 좀 지내요.,이 누나 다 먹겠다. 먹자.
"예쁘다, 왕조연.",응.
응.,현실엔 저런 여자 없어.
현실엔 저런 여자 없어.,넌 요새 누가 제일 예쁘냐?
넌 요새 누가 제일 예쁘냐?,어... 왕조연?
어... 왕조연?,현실에 저런 여자 없다니까. 난 정의여고에 한 명 반했지.
짐 이게 다야? 중국에 일주일 있는다며.,와이셔츠랑 바지. 자켓은?
와이셔츠랑 바지. 자켓은?,넣었어
넣었어,그럼 됐어
그럼 됐어,"중국에 세명, 일본 두명, 한국에도 한 명 남았으니까. 내일 첫 판지면 바로 오겠네 그치?"
"중국에 세명, 일본 두명, 한국에도 한 명 남았으니까. 내일 첫 판지면 바로 오겠네 그치?","내가 괜히 초 치려고 하는 소리가 아니라, 안되는건 안되는거야. 괜히 국민들한테 이런 희망 같은거 심어주지 말고 그냥 돌아와가지고 우리 피자나 사줘. 종로에 하나 새로 생겼단다"
"내가 괜히 초 치려고 하는 소리가 아니라, 안되는건 안되는거야. 괜히 국민들한테 이런 희망 같은거 심어주지 말고 그냥 돌아와가지고 우리 피자나 사줘. 종로에 하나 새로 생겼단다",이기면 어떡할건데?
이기면 어떡할건데?,이기면 너 하고싶은거 하는 거지. 그걸 나한테 물어.
이기면 너 하고싶은거 하는 거지. 그걸 나한테 물어.,"아휴, 술을 마시기를 하냐. 여자를 만나기를 하냐. 넌 뭔 재미로 사니?"
"아휴, 술을 마시기를 하냐. 여자를 만나기를 하냐. 넌 뭔 재미로 사니?",너 뭐 하고 싶은거 없어? 바둑두는거 말고 하고 싶은거 없어?
너 뭐 하고 싶은거 없어? 바둑두는거 말고 하고 싶은거 없어?,영화
영화,영화배우?
영화배우?,영화 보고 싶어
영화 보고 싶어,이번에 이기면 보면 되겠네. 이번에 이기면 봐
이번에 이기면 보면 되겠네. 이번에 이기면 봐,"아이고, 그전에 택아. 옷부터 다시 입자."
"아이고, 그전에 택아. 옷부터 다시 입자.",내가 이해가 안가. 사람들이 너한테 왜 지는거냐? 참 진짜
내가 이해가 안가. 사람들이 너한테 왜 지는거냐? 참 진짜,"내, 내가 할게."
안녕하세요,아 오셨어요
아 오셨어요,예
예,어 저기 얼굴에 벚꽃 붙었어요. 아니아니 거기 말고 조금 더 위
어 저기 얼굴에 벚꽃 붙었어요. 아니아니 거기 말고 조금 더 위,여기요?
형형형형형형 우리 이제 그만타고 사우나 가자 야 너..너도 힘들어보이니까 집에 가 ,그럼 뭐 그럴까요 작가님 조심히 들어가세요 
그럼 뭐 그럴까요 작가님 조심히 들어가세요 ,예 
언니 안녕하세요,안녕하세요
안녕하세요,날이 좋아서 그런가 너무 덥죠. 여자들은 이래서 불편하다니깐요 으 민망해
야 왜 이렇게 밥을 못먹냐,에?
에?,"야 니가 좋아하는 꼬막이다, 여기다 밥먹어"
"야 니가 좋아하는 꼬막이다, 여기다 밥먹어",어 명희네는 아니다 이거지? 어 그래 언니 들어가 쉬어 응응
어 명희네는 아니다 이거지? 어 그래 언니 들어가 쉬어 응응,강릉 큰 이모야? 왜?
강릉 큰 이모야? 왜?,"응 간밤에 황금돼지가 치마폭에 퐉 뛰어들지 뭐야, 분명히 태몽같은데"
"응 간밤에 황금돼지가 치마폭에 퐉 뛰어들지 뭐야, 분명히 태몽같은데",태몽이요? 장모님 진짜 용하시네
태몽이요? 장모님 진짜 용하시네,"가만, 이거 혹시 영채 너 셋째 가진거 아니지?"
"가만, 이거 혹시 영채 너 셋째 가진거 아니지?","엄마도 참, 걱정마. 난 아니야"
"엄마도 참, 걱정마. 난 아니야","그럼 누구야, 분명히 태몽 맞는데"
"그럼 누구야, 분명히 태몽 맞는데",잘 먹었습니다
잘 먹었습니다,"아 좀 더 먹으라니까, 그 사람 참. 아쉬운 소리말고 밥이나 먹어"
"아 좀 더 먹으라니까, 그 사람 참. 아쉬운 소리말고 밥이나 먹어",죽기전에 영애년 태몽 한번 꿔보면 소원이 없겠네
어? 윤대리님 손 왜그러세요?,그냥 좀 다쳤어
그냥 좀 다쳤어,근데 정과장님은요? 한 집 사시면서 같이 출근 안하셨어요?
근데 정과장님은요? 한 집 사시면서 같이 출근 안하셨어요?,몰라 그놈 자식 출근하든지 말든지
몰라 그놈 자식 출근하든지 말든지,정과장님! 눈은 왜 그모양 그꼴이에요?
정과장님! 눈은 왜 그모양 그꼴이에요?,"궁예인줄, 근데 거기서 주무셨어요?"
"궁예인줄, 근데 거기서 주무셨어요?","뭐야, 근데 어떻게 영업직원 한명도 출근 안했어? 지금 시간이 몇신데? 한대리네. 아이 침침해라, 수민씨 이것 좀 읽어줘봐"
"뭐야, 근데 어떻게 영업직원 한명도 출근 안했어? 지금 시간이 몇신데? 한대리네. 아이 침침해라, 수민씨 이것 좀 읽어줘봐",조빠 정과장 잘들어라. 지성이라곤 어림 반푼어치도 없는 이 조같은 회사 때려 치울란다 라는데요
조빠 정과장 잘들어라. 지성이라곤 어림 반푼어치도 없는 이 조같은 회사 때려 치울란다 라는데요,"하여간 요즘 젊은 것들은 사람이 말이야. 뭐야, 아 여보세요? 아예 최사장님, 예? 아 갑자기 그렇게 일을 펑크내면 어떡해요? 아이 최사, 여보세요 최사장님!"
"하여간 요즘 젊은 것들은 사람이 말이야. 뭐야, 아 여보세요? 아예 최사장님, 예? 아 갑자기 그렇게 일을 펑크내면 어떡해요? 아이 최사, 여보세요 최사장님!",아이 무슨 전환데 그래요?
아이 무슨 전환데 그래요?,아니 간판사에서 우리 일 다 빼겠대. 대금 넣기 전까지는 작업 안들어가겠데
아니 간판사에서 우리 일 다 빼겠대. 대금 넣기 전까지는 작업 안들어가겠데,아니 갑자기 이제와서 왜
아니 갑자기 이제와서 왜,"왜냐뇨, 조사장 잡혀들어가고 회사 망할까봐 미리 발빼는거죠 뭐"
"왜냐뇨, 조사장 잡혀들어가고 회사 망할까봐 미리 발빼는거죠 뭐","어떡해요, 내일 당장 오복횟집이랑 싱싱노래방 개업식인데"
"어떡해요, 내일 당장 오복횟집이랑 싱싱노래방 개업식인데","간판도 없이 개업시키게 생겼네 진짜, 망했네 망했어"
"간판도 없이 개업시키게 생겼네 진짜, 망했네 망했어","아무리 그래도 낙원사때부터 거래한 정이 있지 너무하시네 진짜, 뭔 방법 없나"
 저기 선우야.,딴 사람한텐 절대 얘기 안할게요.
딴 사람한텐 절대 얘기 안할게요.,독심술하니. 
독심술하니. ,관심이 많으니까.
관심이 많으니까.,"야, 누나 지금 그럴 기분아니다."
근데 손은 왜 그러냐.,"아, 넘어졌어요."
"아, 넘어졌어요.",어이그. 덩치는 산만해서 하는 짓은. 
안아프디?,저 먼저 갈게요.
"쌤, 타세요. 얼른요! 큰일 났어요 큰일!",뭔데?
뭔데?,얼른 타시라니까요. 클났다구요 글쎄. 
얼른 타시라니까요. 클났다구요 글쎄. ,뭔데 또.
뭔데 또.,무슨 일인데? 무슨 큰일이 났다는건데?
무슨 일인데? 무슨 큰일이 났다는건데?,완전 큰일이죠. 큰일이 안 났는데 큰일났다고 뻥쳤으니 이게 큰일이 아니고 뭐겠어요. 
완전 큰일이죠. 큰일이 안 났는데 큰일났다고 뻥쳤으니 이게 큰일이 아니고 뭐겠어요. ,뭐어? 공부는 안하고 뭐하는거야. 이 차는 또 뭐고?
뭐어? 공부는 안하고 뭐하는거야. 이 차는 또 뭐고?,아 그냥 누구 차 좀 빌렸어요. 쌤 집에 데려다 주려구요. 
아 그냥 누구 차 좀 빌렸어요. 쌤 집에 데려다 주려구요. ,뭐? 날 왜 델다줘? 너 혹시 알았니?
뭐? 날 왜 델다줘? 너 혹시 알았니?,네? 뭘요?
네? 뭘요?,"어, 아 아니야. "
"어, 아 아니야. ",쌤 기절한거요?
쌤 기절한거요?,너 설마 그것도 봤니? 그 짤?
너 설마 그것도 봤니? 그 짤?,네?
네?,"아, 아니야. "
"아, 아니야. ","숲에서 곰 만나 기절한거요, 아님 오바마 만나 기절한거요?"
"숲에서 곰 만나 기절한거요, 아님 오바마 만나 기절한거요?",다 봤구나. 그랬구나. 
다 봤구나. 그랬구나. ,애들도 참 못됐어요. 사람이 쓰러졌는데 그런 짤이나 만들구. 다들 쌤이 긴장해서 쓰러진 줄 알고 그러나본데 왜 사실대로 말씀 안하세요?
애들도 참 못됐어요. 사람이 쓰러졌는데 그런 짤이나 만들구. 다들 쌤이 긴장해서 쓰러진 줄 알고 그러나본데 왜 사실대로 말씀 안하세요?,뭘?
뭘?,동영이한테 다 들었어요. 쌤 쓰러진 거 다른 쌤이 준 약먹고 알러지 쇼크 온거라구. 그거 왜 말씀 안하시냐구요. 
동영이한테 다 들었어요. 쌤 쓰러진 거 다른 쌤이 준 약먹고 알러지 쇼크 온거라구. 그거 왜 말씀 안하시냐구요. ,말해봤자 그 교수님 탓하는거밖에 안될 거 같아서. 좋은뜻으로 주신건데 곤란하게 만들 수 없잖아. 
말해봤자 그 교수님 탓하는거밖에 안될 거 같아서. 좋은뜻으로 주신건데 곤란하게 만들 수 없잖아. ,지금 쌤이 더 곤란한 상황이거든요. 
지금 쌤이 더 곤란한 상황이거든요. ,어쨌든 먹고 쓰러진 건 난데 뭐. 내가 감당하는 게 맞아. 내가 알아서 할게. 
어쨌든 먹고 쓰러진 건 난데 뭐. 내가 감당하는 게 맞아. 내가 알아서 할게. ,"아이고, 정말 착하신건지 답답하신건지. 근데 몸 진짜 괜찮은 거 맞아요?"
"아이고, 정말 착하신건지 답답하신건지. 근데 몸 진짜 괜찮은 거 맞아요?","어, 괜찮아."
아 그럼 교회랑 유치원 현수막은 해결 됐고. 책자는?,아 예 저희가 지금 하고있어요
아 예 저희가 지금 하고있어요,아 바꼈어 여기
아 바꼈어 여기,아 
수민씬? 잘돼가?,아닌데. 택도없는데. 이딴거 말도 안해주고 회사 관두고.
아닌데. 택도없는데. 이딴거 말도 안해주고 회사 관두고.,걱정마. 안그래도 내가 지원사격 부탁해놨어
걱정마. 안그래도 내가 지원사격 부탁해놨어,지원사격이요?
지원사격이요?,사장님사장님사장님사장님사장님 아 웬일이야 베트남계신거 아니었어요?
사장님사장님사장님사장님사장님 아 웬일이야 베트남계신거 아니었어요?,이 소름끼치게 격한 인사는 넣어둬 넣어두고 일부터 하자 우리. 지금 무지 급하다거덩
이 소름끼치게 격한 인사는 넣어둬 넣어두고 일부터 하자 우리. 지금 무지 급하다거덩,간만에 몸 좀 풀어볼까?
수민씨 나 뭐부터 하면 돼?,학원 전단지인데요. 이미지부터 따주세요 라부장님
"고맙다, 공명아. 이제 얼른 가서 공부해. ",네. 근데 쌤 집은 어디에요?
네. 근데 쌤 집은 어디에요?,어? 어 뭐 그냥 저어기. 
어? 어 뭐 그냥 저어기. ,"아아, 저기요. 커튼 되게 귀엽네요. 딱 여자집같네. 역시 집도 주인 닮나봐요. "
"아아, 저기요. 커튼 되게 귀엽네요. 딱 여자집같네. 역시 집도 주인 닮나봐요. ",그치? 주인닮았지. 암튼 이제 얼른가 얼른. 
그치? 주인닮았지. 암튼 이제 얼른가 얼른. ,네.
기다리긴 뭘 기다려,사장님 왜 그러세요 
아 사장님 특수 인쇄 맡길만한 데 아시는데 있으세요? ,낙원사댁 거리에 있는 인쇄소 거긴어때? 전화 한 통 넣어줘?
낙원사댁 거리에 있는 인쇄소 거긴어때? 전화 한 통 넣어줘?,아 그럼 저희야 땡큐죠 
야~ 이실장은 아주 전투적으로 먹네. 자기가 부대원이여서 부대찌개를 잘먹나?,부대원이요?
부대원이요?,솔로 부대요. 혼자서 와와와왁. 솔로니까 룰루루 이 아무래도 지금 부대찌개값보다 지금 여기보면 라면 사리값이 더 나올거 같습니다.
솔로 부대요. 혼자서 와와와왁. 솔로니까 룰루루 이 아무래도 지금 부대찌개값보다 지금 여기보면 라면 사리값이 더 나올거 같습니다.,어어. 괜찮아요. 이실장 먹고 싶은거 실컷 먹어야죠. 보너슨데.
어어. 괜찮아요. 이실장 먹고 싶은거 실컷 먹어야죠. 보너슨데.,보너스요?
보너스요?,아 사무장님 말고 이실장말이요. 이실장은 연말 보너스가 이거예요.
아 사무장님 말고 이실장말이요. 이실장은 연말 보너스가 이거예요.,"네? 아니, 그게 무슨 말씀이세요."
"네? 아니, 그게 무슨 말씀이세요.","아, 아시다시피 사무실 사정이 예전같지가 않아서요. 그래서 보너스를 업적이나 공헌도에 따라서 지급하기로 했습니다. 최사무장님은 영업으로 신권을 꽤 가지고 오신데 반해 이실장님은 한게 없잖아요. 그럼 저 먼저 일어날테니까 드시고 들어오세요. 아 그리고 이실장. 밥먹고 은행들러서 사무장님 보너스 넣어드리도록 하세요."
"아, 아시다시피 사무실 사정이 예전같지가 않아서요. 그래서 보너스를 업적이나 공헌도에 따라서 지급하기로 했습니다. 최사무장님은 영업으로 신권을 꽤 가지고 오신데 반해 이실장님은 한게 없잖아요. 그럼 저 먼저 일어날테니까 드시고 들어오세요. 아 그리고 이실장. 밥먹고 은행들러서 사무장님 보너스 넣어드리도록 하세요.","아, 조심해서 들어가십시오."
우리 강아지. 이럴 때는 우리 기범이가 빠지면 생파도 아이다. ,"아 당연하지. 할머니, 생일축하해. "
예 사장님,영자씨 일 끝났으면 일로 올래? 여기 낙원사 사람들 다 모여있는데 영자씨 보고 싶다고 난리야
영자씨 일 끝났으면 일로 올래? 여기 낙원사 사람들 다 모여있는데 영자씨 보고 싶다고 난리야,아 저기 그게요
아 저기 그게요,아 오바이트할 거 같애
아 오바이트할 거 같애,그러게 그만 마시라고 했잖아
그러게 그만 마시라고 했잖아,뭐야? 영자씨 술집이야?
뭐야? 영자씨 술집이야?,예 그냥 바이어들하고 얘기 좀 하고 있어요
예 그냥 바이어들하고 얘기 좀 하고 있어요,접대하러 간거야? 임산부가 접대가 웬말이야
접대하러 간거야? 임산부가 접대가 웬말이야,그런거 아니구요 그냥 술자리에서 대충 분위기만 맞춰주고 있어요
그런거 아니구요 그냥 술자리에서 대충 분위기만 맞춰주고 있어요,그게 그거지 뭐야 혁규씨는 뭐하고
그게 그거지 뭐야 혁규씨는 뭐하고,제부가 제 대신 술 다 마셔주고 있으니까 걱정하지마세요
제부가 제 대신 술 다 마셔주고 있으니까 걱정하지마세요,어딘데? 내가 지금 데리러 갈게
어딘데? 내가 지금 데리러 갈게,괜찮아요 이따 다시 전화할게요 끊어요
사놓고 한번도 못 입힌건데 조카님 줘야겠다 뭐 더 줄거 없나? 아들인지 딸인지를 알아야 내가,뭐야 아니 해진이 어릴때 옷을 왜?
뭐야 아니 해진이 어릴때 옷을 왜?,그냥
그냥,어쩌려고 그래? 내가 셋째는 안된다고 그랬지?
어쩌려고 그래? 내가 셋째는 안된다고 그랬지?,아퍼 그런거 아니라니까
아퍼 그런거 아니라니까,근데 왜 이거 꺼내놓고 있어 해진이 해밀이는 입지도 못하는데 너 사실대로 안 불어?
근데 왜 이거 꺼내놓고 있어 해진이 해밀이는 입지도 못하는데 너 사실대로 안 불어?,아 왜 또 이렇게 시끄럽게 그래? 무슨 일이야?
아 왜 또 이렇게 시끄럽게 그래? 무슨 일이야?,엄마 진정해 아니야 난 아니라니까
엄마 진정해 아니야 난 아니라니까,넌 아니라고? 그럼 누군데
넌 아니라고? 그럼 누군데,그게 어 오빠
그게 어 오빠,큰일났다규 처형 응급실에 실려가셨다규
큰일났다규 처형 응급실에 실려가셨다규,뭐? 언니가? 임산부가 응급실엔 왜?
뭐? 언니가? 임산부가 응급실엔 왜?,영채야 지금 이게 무슨 소리야
아 다행히 기간 맞춰 그래도 잘 마무리했네,자 그럼 일도 마쳤겠다 퇴근들하지? 이런말 하니까 꼭 내가 이 회사 사장 같네
자 그럼 일도 마쳤겠다 퇴근들하지? 이런말 하니까 꼭 내가 이 회사 사장 같네,오늘 하루는 진짜 사장님 같으셨어요
오늘 하루는 진짜 사장님 같으셨어요,그러게요
그러게요,뭐야 왜그래 수민씨? 아닌데? 사장안같은데? 이렇게 안하니까 이상하잖아 
뭐야 왜그래 수민씨? 아닌데? 사장안같은데? 이렇게 안하니까 이상하잖아 ,아닌데? 사장님 같으셔서 사장님 같다고 한 것 뿐인데 
아닌데? 사장님 같으셔서 사장님 같다고 한 것 뿐인데 ,왜들이래? 소름끼치게 오글거리게
왜들이래? 소름끼치게 오글거리게,아 그럼 오글오글 보글보글 지글지글 안주 쫙 깔아놓고 한 잔 어때요?
아 그럼 오글오글 보글보글 지글지글 안주 쫙 깔아놓고 한 잔 어때요?,그럴까? 오랜만에 회식 한 번 떙겨봐?
뭐야? 이유식이야? 라부장의 시간은 거꾸로 가?,아니 제가 먹으려고 그러는게 아니구요 마이클 줄려구요  
아니 제가 먹으려고 그러는게 아니구요 마이클 줄려구요  ,왠 개야?
왠 개야?,회사에 누가 두고간 갠데 불쌍해서 라부장님이 집에 잠깐 데려가신데요
회사에 누가 두고간 갠데 불쌍해서 라부장님이 집에 잠깐 데려가신데요,아니 누가 인쇄소에 쳐박아 놨지 뭐야 돌본 정도 있고 내가 데려가야지 어쩌겠어   
아니 누가 인쇄소에 쳐박아 놨지 뭐야 돌본 정도 있고 내가 데려가야지 어쩌겠어   ,으유 으유 으유 으유 말만 쎘지 마음은 약한 우리 라부장 한 잔 받아 오늘 하루 수고했어 라부장
라부장님,뭐야 갑자기 왜 그래?  
뭐야 갑자기 왜 그래?  ,아니 요즘에 맨날 아줌마 저기요 이렇게 불리다가 사장님이 라부장이라고 불러주시니까 그냥 옛날 낙원사로 돌아간거 같애
돌림 노래해? 왜 돌아가면서 울어?,그동안 지성사에서 저 얼마나 서러웠는지 몰라요 조사장 일만 잘 물어오면 뭐해요 사람을 사람 취급 안해주는데 수현이랑 수현엄마 아니었으면요 진작에 때려쳤다구요
제가 죄송해요 그동안 싸가지 없이 굴어가지고 ,니가 뭔 잘못이냐? 이게 다 조사장 때문이지 
니가 뭔 잘못이냐? 이게 다 조사장 때문이지 ,힘 힘내세요 두분
힘 힘내세요 두분,분위기 왜들 이래?
분위기 왜들 이래?,암튼 오늘 사장님 덕분에 오랜만에 네일 한거 같애서 좋아요 이거 베트남 호치민 쌀국수 무료쿠폰인데 넣어둬 넣어둬
암튼 오늘 사장님 덕분에 오랜만에 네일 한거 같애서 좋아요 이거 베트남 호치민 쌀국수 무료쿠폰인데 넣어둬 넣어둬,뭐야? 나 이거 도로 베트남 가야 돼?
뭐야? 나 이거 도로 베트남 가야 돼?,라부장님 쿠폰보니까 진짜 낙원사 회식 같네요 
라부장님 쿠폰보니까 진짜 낙원사 회식 같네요 ,그러게 옛날 생각 나네  
그러게 옛날 생각 나네  ,어? 낙원이다 
어? 낙원이다 ,어 진짜네?
코피는 괜찮아?,아이씨 뭐야.
무조건 이렇게 저한테 패스하시라규요. 제가 흑기사 해드릴테니까.,아 근데 그러다가 누가 눈치채면 어떡해요?
아 근데 그러다가 누가 눈치채면 어떡해요?,그래서 만약을 대비한 플랜B가 있다규요. 막걸리 대신에 우유 담아놨으니까 여차하면 이거 드시면 된다규요.
그래서 만약을 대비한 플랜B가 있다규요. 막걸리 대신에 우유 담아놨으니까 여차하면 이거 드시면 된다규요.,오. 이런 방법이 있었네요.
오. 이런 방법이 있었네요.,그리고 만약의 만약을 대비한 플랜C
그리고 만약의 만약을 대비한 플랜C,이걸로 뭘 하는건데요 제부?
이걸로 뭘 하는건데요 제부?,어쩔 수 없이 술을 마셨을 경우
이렇게 하면 감쪽같다규요.,오
오,저만 믿고 따라오시라규요.
저만 믿고 따라오시라규요.,예
예,그리고 무엇보다 일본사람들이 원래 얌전해서 우리처럼 막 부어라 마셔라 이런 분위기가 아니잖아요. 아마 지금쯤 조용히 식사하면서 하이! 하이! 요러고 있을 분위기일거라구요.
그리고 무엇보다 일본사람들이 원래 얌전해서 우리처럼 막 부어라 마셔라 이런 분위기가 아니잖아요. 아마 지금쯤 조용히 식사하면서 하이! 하이! 요러고 있을 분위기일거라구요.,이사장
어 수연이 안녕. 오빠 데이트하러 간다. 건투를 빌어줘.,어 택이 벌써 왔어. 너 먼저 가있어. 나 좀 늦게.
"뭐야, 수민씨 이제야 출근한 거야? 지금 시간이 몇 신데! 또 남친 집에서 잤어?",아닌데. 전화로 밤새 싸웠는데요? 개새끼.
아닌데. 전화로 밤새 싸웠는데요? 개새끼.,어머 어머... 개새끼가 뭐야 개새끼가!
아 뭐야!,왜 휴지 없어?
왜 휴지 없어?,아니요. 옷이 없어요.
뭐?,아휴... 담배 끊어야 되는데.
아휴... 담배 끊어야 되는데.,형 내년부턴 담배 끊을까요?
형 내년부턴 담배 끊을까요?,옷을 안 입었다니? 그게 무슨 소리야?
옷을 안 입었다니? 그게 무슨 소리야?,남친이랑 밤새 싸우고 정신이 없었어요. 
남친이랑 밤새 싸우고 정신이 없었어요. ,아니 아무리 그래도 그렇지. 설마 코트 속에 홀딱 벗었다는 건 아니지? 여기서 뭐하는 거예요?
아니 아무리 그래도 그렇지. 설마 코트 속에 홀딱 벗었다는 건 아니지? 여기서 뭐하는 거예요?,다...담배 하나 피러 가려고. 
다...담배 하나 피러 가려고. ,수민씨 어디 가? 얼른 가서 옷 사입고 와!
수민씨 어디 가? 얼른 가서 옷 사입고 와!,아휴 나 오늘부터 다 담배 끊으려고.
아휴 나 오늘부터 다 담배 끊으려고.,그럼요! 몸에도 안 좋은데 끊어야죠.
감기 걸리신 거 아니예요?, 어 아니야~ 차에서 자서 그런가봐. 영자씨는 괜찮아?
 어 아니야~ 차에서 자서 그런가봐. 영자씨는 괜찮아?,"네, 아 오늘 미팅 있어서 일찍 올라가 보셔야 된다고 그랬죠?"
"네, 아 오늘 미팅 있어서 일찍 올라가 보셔야 된다고 그랬죠?",어... 오오오 시간이 없어 시간이.
